[
  {
    "id": "fa_p",
    "from": "ف",
    "to": "p",
    "explanation": {
      "arz": "الفا بتبقى p، لأن الإندونيسي الأصلي مفيهوش صوت f",
      "ar": "تتحول الفاء إلى p لأن الإندونيسية الأصلية تخلو من صوت f",
      "en": "Arabic f becomes p: native Indonesian had no f sound"
    },
    "examples": [
      "pikir",
      "paham",
      "pasal"
    ]
  },
  {
    "id": "kha_k",
    "from": "خ",
    "to": "k / kh",
    "explanation": {
      "arz": "الخا بتبقى k (ساعات بتتكتب kh)",
      "ar": "تتحول الخاء إلى k، وتُكتب أحيانًا kh",
      "en": "Arabic kh becomes k (sometimes still written kh)"
    },
    "examples": [
      "kabar",
      "kamis"
    ]
  },
  {
    "id": "qaf_k",
    "from": "ق",
    "to": "k",
    "explanation": {
      "arz": "القاف بتبقى k",
      "ar": "تتحول القاف إلى k",
      "en": "Arabic q becomes k"
    },
    "examples": [
      "kalbu",
      "kuat",
      "kabul"
    ]
  },
  {
    "id": "ta_marbuta_at",
    "from": "ة",
    "to": "-at",
    "explanation": {
      "arz": "التا المربوطة في الآخر بتتنطق وتتكتب -at",
      "ar": "تُنطق التاء المربوطة في آخر الكلمة وتُكتب -at",
      "en": "Final ta marbuta is pronounced and written -at"
    },
    "examples": [
      "selamat",
      "lezat",
      "kalimat"
    ]
  },
  {
    "id": "ta_marbuta_ah",
    "from": "ة",
    "to": "-ah",
    "explanation": {
      "arz": "في كلمات تانية التا المربوطة بتبقى -ah زي ما بنقف عليها هاء",
      "ar": "في كلمات أخرى تصير التاء المربوطة -ah كالوقف عليها بالهاء",
      "en": "In other words final ta marbuta becomes -ah, as in pausal Arabic"
    },
    "examples": [
      "ibadah",
      "sedekah"
    ]
  },
  {
    "id": "ayn_k",
    "from": "ع",
    "to": "k",
    "explanation": {
      "arz": "العين في آخر المقطع بتبقى k",
      "ar": "تتحول العين في آخر المقطع إلى k",
      "en": "Ayn at the end of a syllable becomes k"
    },
    "examples": [
      "rakyat",
      "maklum",
      "nikmat"
    ]
  },
  {
    "id": "ayn_vowel",
    "from": "ع",
    "to": "(vowel)",
    "explanation": {
      "arz": "العين في أول الكلمة أو بين حرفين متحركين بتختفي ويفضل الحرف المتحرك",
      "ar": "تسقط العين في أول الكلمة أو بين حركتين ويبقى الصوت المتحرك",
      "en": "Ayn at the start or between vowels drops, leaving the vowel"
    },
    "examples": [
      "ilmu",
      "umur"
    ]
  },
  {
    "id": "tha_s",
    "from": "ث",
    "to": "s",
    "explanation": {
      "arz": "الثا بتبقى s",
      "ar": "تتحول الثاء إلى s",
      "en": "Arabic th (as in think) becomes s"
    },
    "examples": [
      "selasa",
      "hadis"
    ]
  },
  {
    "id": "dhal_z",
    "from": "ذ",
    "to": "z / d",
    "explanation": {
      "arz": "الذال بتبقى z (وساعات d)",
      "ar": "تتحول الذال إلى z وأحيانًا d",
      "en": "Arabic dh becomes z (sometimes d)"
    },
    "examples": [
      "lezat",
      "zikir"
    ]
  },
  {
    "id": "dad_d",
    "from": "ض",
    "to": "d / dl / l",
    "explanation": {
      "arz": "الضاد بتبقى d أو dl أو l",
      "ar": "تتحول الضاد إلى d أو dl أو l",
      "en": "Arabic ḍ becomes d, dl or l"
    },
    "examples": [
      "hadir",
      "rida"
    ]
  },
  {
    "id": "zha_l",
    "from": "ظ",
    "to": "l / z",
    "explanation": {
      "arz": "الظا بتبقى l أو z",
      "ar": "تتحول الظاء إلى l أو z",
      "en": "Arabic ẓ becomes l or z"
    },
    "examples": [
      "lahir",
      "lafal",
      "zalim"
    ]
  },
  {
    "id": "sad_s",
    "from": "ص",
    "to": "s",
    "explanation": {
      "arz": "الصاد بتبقى s عادية",
      "ar": "تتحول الصاد إلى s",
      "en": "Arabic ṣ becomes plain s"
    },
    "examples": [
      "sabar",
      "sahabat"
    ]
  },
  {
    "id": "shin_sy",
    "from": "ش",
    "to": "sy",
    "explanation": {
      "arz": "الشين بتتكتب sy",
      "ar": "تُكتب الشين sy",
      "en": "Arabic sh is written sy"
    },
    "examples": [
      "syukur",
      "syarat",
      "masyarakat"
    ]
  },
  {
    "id": "ha_h",
    "from": "ح",
    "to": "h",
    "explanation": {
      "arz": "الحا بتبقى h عادية",
      "ar": "تتحول الحاء إلى h",
      "en": "Arabic ḥ becomes plain h"
    },
    "examples": [
      "hewan",
      "hak"
    ]
  },
  {
    "id": "vowel_insert",
    "from": "(سكون)",
    "to": "(vowel)",
    "explanation": {
      "arz": "الحرفين الساكنين ورا بعض بيتفصلوا بحرف متحرك: فِكْر ← pikir",
      "ar": "يُفصل بين الساكنين بحركة: فِكْر ← pikir",
      "en": "A vowel breaks up two consonants in a row: fikr → pikir"
    },
    "examples": [
      "pikir",
      "hukum",
      "sabar"
    ]
  },
  {
    "id": "final_vowel",
    "from": "(آخر الكلمة)",
    "to": "-u / -a / -i",
    "explanation": {
      "arz": "لو الكلمة خلصت بحرفين ساكنين بيتزود حرف متحرك في الآخر: وَقْت ← waktu، أَهْل ← ahli",
      "ar": "إذا انتهت الكلمة بساكنين زيدت حركة في آخرها: وَقْت ← waktu، أَهْل ← ahli",
      "en": "A final consonant cluster gets an extra vowel: waqt → waktu, ahl → ahli"
    },
    "examples": [
      "waktu",
      "ilmu",
      "kalbu",
      "ahli"
    ]
  },
  {
    "id": "shin_s",
    "from": "ش",
    "to": "s",
    "explanation": {
      "arz": "في كلمات قديمة الشين بقت s عادية: شيطان ← setan",
      "ar": "في كلمات قديمة صارت الشين s: شيطان ← setan",
      "en": "In older loans sh became plain s: shayṭān → setan"
    },
    "examples": [
      "setan",
      "sejarah",
      "serikat"
    ]
  },
  {
    "id": "qaf_g",
    "from": "ق",
    "to": "g",
    "explanation": {
      "arz": "ساعات القاف بتبقى g، زي ما بننطقها في الصعيد: قميص ← gamis",
      "ar": "قد تصير القاف g: قميص ← gamis",
      "en": "Sometimes q becomes g, as in Upper Egypt: qamīṣ → gamis"
    },
    "examples": [
      "gamis"
    ]
  },
  {
    "id": "ayn_dropped",
    "from": "ع",
    "to": "(dropped)",
    "explanation": {
      "arz": "ساعات العين بتقع خالص من غير ما تسيب أثر، وغالبًا بعد حرف ساكن: جمعة ← jumat، ركعة ← rakaat، أربعاء ← rabu",
      "ar": "قد تسقط العين دون أثر، وغالبًا بعد الساكن: جمعة ← jumat، ركعة ← rakaat، أربعاء ← rabu",
      "en": "Ayn can vanish without a trace, usually after a consonant: jumʿa → jumat, rakʿa → rakaat, arbiʿāʾ → rabu"
    },
    "examples": [
      "jumat",
      "rabu",
      "rakaat"
    ]
  }
]
